Question,Answer
"За ĸаĸие достижения УрФУ дает дополнительные баллы?","Поступающие на обучение по программам магистратуры в 2023 году вправе представить сведения о своих индивидуальных достижениях, результаты которых учитываются при приеме на обучение и включаются в сумму конкурсных баллов. Ознакомиться с баллами за индивидуальные достижения можно в п. 4 раздела 4 правил приема. Правила приема: magister.urfu.ru/fileadmin/user_upload/site_15406/2023/admission/Pravila_priema_magistratura_2023.pdf Подтверждение индивидуальных достижений происходит на странице «Льготы и достижения» личного кабинета абитуриента priem.urfu.ru. Страница разделена на разделы. Каждый раздел соответствует одному индивидуальному достижению, которое учитывается в УрФУ. Загружать нужно только те документы, которые перечислены в списке соответствующего раздела, другие документы рассматриваться не будут."
"Баллы за индивидуальные достижения","Поступающие на обучение по программам магистратуры в 2023 году вправе представить сведения о своих индивидуальных достижениях, результаты которых учитываются при приеме на обучение и включаются в сумму конкурсных баллов. Ознакомиться с баллами за индивидуальные достижения можно в п. 4 раздела 4 правил приема. Правила приема: magister.urfu.ru/fileadmin/user_upload/site_15406/2023/admission/Pravila_priema_magistratura_2023.pdf Подтверждение индивидуальных достижений происходит на странице «Льготы и достижения» личного кабинета абитуриента priem.urfu.ru. Страница разделена на разделы. Каждый раздел соответствует одному индивидуальному достижению, которое учитывается в УрФУ. Загружать нужно только те документы, которые перечислены в списке соответствующего раздела, другие документы рассматриваться не будут."
"Минимальные баллы в 2023 году","Подавать документы на бюджетную и на контрактную основу можно с минимальными баллами, установленными в УрФУ. Минимальный балл – это нижний порог баллов за вступительные испытания, закрепленный в правилах приема. Результаты вступительных испытаний оцениваются по стобалльной шкале. Минимальный балл для поступления в магистратуру в 2023 году – 20 баллов. Если результаты поступающего ниже минимального балла, его статус в списках поступающих будет «выбыл из конкурса». Правила приема: magister.urfu.ru/fileadmin/user_upload/site_15406/2023/admission/Pravila_priema_magistratura_2023.pdf"
"Если у меня меньше минимальных баллов, установленных УрФУ, могу ли я подать доĸументы?","Подавать документы на бюджетную и на контрактную основу можно с минимальными баллами, установленными в УрФУ. Минимальный балл – это нижний порог баллов за вступительные испытания, закрепленный в правилах приема. Результаты вступительных испытаний оцениваются по стобалльной шкале. Минимальный балл для поступления в магистратуру в 2023 году – 20 баллов. Если результаты поступающего ниже минимального балла, его статус в списках поступающих будет «выбыл из конкурса». Правила приема: magister.urfu.ru/fileadmin/user_upload/site_15406/2023/admission/Pravila_priema_magistratura_2023.pdf"
"С ĸаĸими баллами можно подавать доĸументы?","Подавать документы на бюджетную и на контрактную основу можно с минимальными баллами, установленными в УрФУ. Минимальный балл – это нижний порог баллов за вступительные испытания, закрепленный в правилах приема. Результаты вступительных испытаний оцениваются по стобалльной шкале. Минимальный балл для поступления в магистратуру в 2023 году – 20 баллов. Если результаты поступающего ниже минимального балла, его статус в списках поступающих будет «выбыл из конкурса». Правила приема: magister.urfu.ru/fileadmin/user_upload/site_15406/2023/admission/Pravila_priema_magistratura_2023.pdf"
"Сĸольĸо минимум нужно баллов?","Подавать документы на бюджетную и на контрактную основу можно с минимальными баллами, установленными в УрФУ. Минимальный балл – это нижний порог баллов за вступительные испытания, закрепленный в правилах приема. Результаты вступительных испытаний оцениваются по стобалльной шкале. Минимальный балл для поступления в магистратуру в 2023 году – 20 баллов. Если результаты поступающего ниже минимального балла, его статус в списках поступающих будет «выбыл из конкурса». Правила приема: magister.urfu.ru/fileadmin/user_upload/site_15406/2023/admission/Pravila_priema_magistratura_2023.pdf"
"Минимальные баллы для поступления на контракт","Подавать документы на бюджетную и на контрактную основу можно с минимальными баллами, установленными в УрФУ. Минимальный балл – это нижний порог баллов за вступительные испытания, закрепленный в правилах приема. Результаты вступительных испытаний оцениваются по стобалльной шкале. Минимальный балл для поступления в магистратуру в 2023 году – 20 баллов. Если результаты поступающего ниже минимального балла, его статус в списках поступающих будет «выбыл из конкурса». Правила приема: magister.urfu.ru/fileadmin/user_upload/site_15406/2023/admission/Pravila_priema_magistratura_2023.pdf"
"Минимальные баллы для поступления на заочное обучение","Подавать документы на бюджетную и на контрактную основу можно с минимальными баллами, установленными в УрФУ. Минимальный балл – это нижний порог баллов за вступительные испытания, закрепленный в правилах приема. Результаты вступительных испытаний оцениваются по стобалльной шкале. Минимальный балл для поступления в магистратуру в 2023 году – 20 баллов. Если результаты поступающего ниже минимального балла, его статус в списках поступающих будет «выбыл из конкурса». Правила приема: magister.urfu.ru/fileadmin/user_upload/site_15406/2023/admission/Pravila_priema_magistratura_2023.pdf"
"В правилах приема указано, что за сертификат участника олимпиады «Я-профессионал» можно будет получить 10 дополнительных баллов в качестве индивидуальных достижений. Подскажите, пожалуйста, это должен быть сертификат участника заключительного этапа? Должен ли профиль олимпиады соответствовать профилю магистратуры?","Участники олимпиады «Я – профессионал» смогут получить дополнительные баллы при поступлении в магистратуру Уральского федерального университета. Бонус до 150 баллов и индивидуальные достижения предусмотрены в правилах приема в УрФУ 2023 года. Участие в олимпиаде «Я – профессионал» рассматривается приемной комиссией университета в качестве индивидуального достижения и оценивается в дополнительные 10 конкурсных баллов. Профильность для сертификатов участника не важна. Учесть можно один сертификат на все выбранные направления. Результат олимпиады может быть засчитан в качестве вступительного испытания при условии соответствия профиля олимпиады выбранной образовательной программе магистратуры УрФУ. В этом случае для дипломантов олимпиады сумма баллов за вступительные испытания будет определяться следующим образом: медалистам – 150 баллов, победителям – 140, призерам – 130."
"Поступление по ЯП","Участники олимпиады «Я – профессионал» смогут получить дополнительные баллы при поступлении в магистратуру Уральского федерального университета. Бонус до 150 баллов и индивидуальные достижения предусмотрены в правилах приема в УрФУ 2023 года. Участие в олимпиаде «Я – профессионал» рассматривается приемной комиссией университета в качестве индивидуального достижения и оценивается в дополнительные 10 конкурсных баллов. Профильность для сертификатов участника не важна. Учесть можно один сертификат на все выбранные направления. Результат олимпиады может быть засчитан в качестве вступительного испытания при условии соответствия профиля олимпиады выбранной образовательной программе магистратуры УрФУ. В этом случае для дипломантов олимпиады сумма баллов за вступительные испытания будет определяться следующим образом: медалистам – 150 баллов, победителям – 140, призерам – 130."
"Я - профессионал","Участники олимпиады «Я – профессионал» смогут получить дополнительные баллы при поступлении в магистратуру Уральского федерального университета. Бонус до 150 баллов и индивидуальные достижения предусмотрены в правилах приема в УрФУ 2023 года. Участие в олимпиаде «Я – профессионал» рассматривается приемной комиссией университета в качестве индивидуального достижения и оценивается в дополнительные 10 конкурсных баллов. Профильность для сертификатов участника не важна. Учесть можно один сертификат на все выбранные направления. Результат олимпиады может быть засчитан в качестве вступительного испытания при условии соответствия профиля олимпиады выбранной образовательной программе магистратуры УрФУ. В этом случае для дипломантов олимпиады сумма баллов за вступительные испытания будет определяться следующим образом: медалистам – 150 баллов, победителям – 140, призерам – 130."
"Баллы за участие в олимпиаде Я - профессионал","Участники олимпиады «Я – профессионал» смогут получить дополнительные баллы при поступлении в магистратуру Уральского федерального университета. Бонус до 150 баллов и индивидуальные достижения предусмотрены в правилах приема в УрФУ 2023 года. Участие в олимпиаде «Я – профессионал» рассматривается приемной комиссией университета в качестве индивидуального достижения и оценивается в дополнительные 10 конкурсных баллов. Профильность для сертификатов участника не важна. Учесть можно один сертификат на все выбранные направления. Результат олимпиады может быть засчитан в качестве вступительного испытания при условии соответствия профиля олимпиады выбранной образовательной программе магистратуры УрФУ. В этом случае для дипломантов олимпиады сумма баллов за вступительные испытания будет определяться следующим образом: медалистам – 150 баллов, победителям – 140, призерам – 130."
"Какие льготы дает диплом победителя или призера олимпиады «Я – профессионал»","Участники олимпиады «Я – профессионал» смогут получить дополнительные баллы при поступлении в магистратуру Уральского федерального университета. Бонус до 150 баллов и индивидуальные достижения предусмотрены в правилах приема в УрФУ 2023 года. Участие в олимпиаде «Я – профессионал» рассматривается приемной комиссией университета в качестве индивидуального достижения и оценивается в дополнительные 10 конкурсных баллов. Профильность для сертификатов участника не важна. Учесть можно один сертификат на все выбранные направления. Результат олимпиады может быть засчитан в качестве вступительного испытания при условии соответствия профиля олимпиады выбранной образовательной программе магистратуры УрФУ. В этом случае для дипломантов олимпиады сумма баллов за вступительные испытания будет определяться следующим образом: медалистам – 150 баллов, победителям – 140, призерам – 130."
"Результат олимпиады Я - профессионал в качестве вступительного испытания","Участники олимпиады «Я – профессионал» смогут получить дополнительные баллы при поступлении в магистратуру Уральского федерального университета. Бонус до 150 баллов и индивидуальные достижения предусмотрены в правилах приема в УрФУ 2023 года. Участие в олимпиаде «Я – профессионал» рассматривается приемной комиссией университета в качестве индивидуального достижения и оценивается в дополнительные 10 конкурсных баллов. Профильность для сертификатов участника не важна. Учесть можно один сертификат на все выбранные направления. Результат олимпиады может быть засчитан в качестве вступительного испытания при условии соответствия профиля олимпиады выбранной образовательной программе магистратуры УрФУ. В этом случае для дипломантов олимпиады сумма баллов за вступительные испытания будет определяться следующим образом: медалистам – 150 баллов, победителям – 140, призерам – 130."
"Льготы участникам олимпиады Я - профессионал","Участники олимпиады «Я – профессионал» смогут получить дополнительные баллы при поступлении в магистратуру Уральского федерального университета. Бонус до 150 баллов и индивидуальные достижения предусмотрены в правилах приема в УрФУ 2023 года. Участие в олимпиаде «Я – профессионал» рассматривается приемной комиссией университета в качестве индивидуального достижения и оценивается в дополнительные 10 конкурсных баллов. Профильность для сертификатов участника не важна. Учесть можно один сертификат на все выбранные направления. Результат олимпиады может быть засчитан в качестве вступительного испытания при условии соответствия профиля олимпиады выбранной образовательной программе магистратуры УрФУ. В этом случае для дипломантов олимпиады сумма баллов за вступительные испытания будет определяться следующим образом: медалистам – 150 баллов, победителям – 140, призерам – 130."
"Если у меня и еще ĸого-то будет одинаĸовое ĸоличество баллов, ĸаĸ будут выбирать того, ĸто поступит?","В случае, если у нескольких студентов будет одинаковый конкурсный балл на границе проходного, то дополнительным критерием будет средний балл диплома. Дата подачи документов не влияет на конкурс. Главное – подать документы в срок и успешно сдать вступительные испытания."
"Что произойдёт, если несколько абитуриентов наберут балл на границе проходного и непроходного? Будет дополнительный конкурс?","В случае, если у нескольких студентов будет одинаковый конкурсный балл на границе проходного, то дополнительным критерием будет средний балл диплома. Дата подачи документов не влияет на конкурс. Главное – подать документы в срок и успешно сдать вступительные испытания."
"Имеет ли значение дата подачи документов при равных баллах?","В случае, если у нескольких студентов будет одинаковый конкурсный балл на границе проходного, то дополнительным критерием будет средний балл диплома. Дата подачи документов не влияет на конкурс. Главное – подать документы в срок и успешно сдать вступительные испытания."
"Учитывается ли средний балл при поступлении?","В случае, если у нескольких студентов будет одинаковый конкурсный балл на границе проходного, то дополнительным критерием будет средний балл диплома. Дата подачи документов не влияет на конкурс. Главное – подать документы в срок и успешно сдать вступительные испытания."
"Повлияет ли на мое поступление то, подам ли я пакет документов раньше других?","В случае, если у нескольких студентов будет одинаковый конкурсный балл на границе проходного, то дополнительным критерием будет средний балл диплома. Дата подачи документов не влияет на конкурс. Главное – подать документы в срок и успешно сдать вступительные испытания."
