Question,Answer
"Что таĸое ИОТ?","Индивидуальные образовательные траектории (ИОТ) – личные маршруты студентов, которые формируются каждый семестр. Учащиеся сами подбирают дисциплины, уровень сложности и технологии обучения. В зависимости от индивидуальных способностей и карьерных планов студенты сами выстраивают свой путь в университете. В данный момент ИОТ реализуют три института: институт новых материалов и технологий, институт фундаментального образования и ИРИТ-РтФ. Студенты могут самостоятельно выбрать технологию реализации дисциплины, уровень сложности, преподавателя и даже курсы другого университета, а в рамках проектного практикума индивидуализация позволяет выбрать проект, команду и даже реального заказчика."
"ИОТ это","Индивидуальные образовательные траектории (ИОТ) – личные маршруты студентов, которые формируются каждый семестр. Учащиеся сами подбирают дисциплины, уровень сложности и технологии обучения. В зависимости от индивидуальных способностей и карьерных планов студенты сами выстраивают свой путь в университете. В данный момент ИОТ реализуют три института: институт новых материалов и технологий, институт фундаментального образования и ИРИТ-РтФ. Студенты могут самостоятельно выбрать технологию реализации дисциплины, уровень сложности, преподавателя и даже курсы другого университета, а в рамках проектного практикума индивидуализация позволяет выбрать проект, команду и даже реального заказчика."
"Как легко окончить магистратуру?","Рекомендуем выбрать действительно интересную образовательную программу и удобную форму обучения, ведь для получения диплома необходимо качественно и вовремя выполнить все необходимые задачи. Руководители программ в УрФУ стараются сделать магистратуру максимально гибкой, удобной в том числе для совмещения с работой. Так, при учебе на очной форме занятия организованы вечерами в будние дни и днем в субботу, а студенты очно-заочной формы полноценно учатся по субботам."
"Можно ли поступить ради корочки?","Рекомендуем выбрать действительно интересную образовательную программу и удобную форму обучения, ведь для получения диплома необходимо качественно и вовремя выполнить все необходимые задачи. Руководители программ в УрФУ стараются сделать магистратуру максимально гибкой, удобной в том числе для совмещения с работой. Так, при учебе на очной форме занятия организованы вечерами в будние дни и днем в субботу, а студенты очно-заочной формы полноценно учатся по субботам."
"Хочу получить корочку магистра без головной боли – это возможно?","Рекомендуем выбрать действительно интересную образовательную программу и удобную форму обучения, ведь для получения диплома необходимо качественно и вовремя выполнить все необходимые задачи. Руководители программ в УрФУ стараются сделать магистратуру максимально гибкой, удобной в том числе для совмещения с работой. Так, при учебе на очной форме занятия организованы вечерами в будние дни и днем в субботу, а студенты очно-заочной формы полноценно учатся по субботам."
"Можно ли легко получить диплом магистра?","Рекомендуем выбрать действительно интересную образовательную программу и удобную форму обучения, ведь для получения диплома необходимо качественно и вовремя выполнить все необходимые задачи. Руководители программ в УрФУ стараются сделать магистратуру максимально гибкой, удобной в том числе для совмещения с работой. Так, при учебе на очной форме занятия организованы вечерами в будние дни и днем в субботу, а студенты очно-заочной формы полноценно учатся по субботам."
"Сложно ли учиться в магистратуре?","Обучение в магистратуре не менее интенсивно, чем получение первого образования. Помимо традиционных зачетов и экзаменов два раза в год, по каждому предмету предусмотрены и промежуточные контрольные точки: тесты, выступления на семинарах, лабораторные и защиты проектов. Поэтому рекомендуем выбрать действительно интересное направление – так желание отсидеться на последней парте пройдет само собой."
"Интенсивность учебы в магистратуре","Обучение в магистратуре не менее интенсивно, чем получение первого образования. Помимо традиционных зачетов и экзаменов два раза в год, по каждому предмету предусмотрены и промежуточные контрольные точки: тесты, выступления на семинарах, лабораторные и защиты проектов. Поэтому рекомендуем выбрать действительно интересное направление – так желание отсидеться на последней парте пройдет само собой."
"Магистратура: поступил, отсижусь на последней парте?","Обучение в магистратуре не менее интенсивно, чем получение первого образования. Помимо традиционных зачетов и экзаменов два раза в год, по каждому предмету предусмотрены и промежуточные контрольные точки: тесты, выступления на семинарах, лабораторные и защиты проектов. Поэтому рекомендуем выбрать действительно интересное направление – так желание отсидеться на последней парте пройдет само собой."
"Насколько интенсивно обучение в магистратуре?","Обучение в магистратуре не менее интенсивно, чем получение первого образования. Помимо традиционных зачетов и экзаменов два раза в год, по каждому предмету предусмотрены и промежуточные контрольные точки: тесты, выступления на семинарах, лабораторные и защиты проектов. Поэтому рекомендуем выбрать действительно интересное направление – так желание отсидеться на последней парте пройдет само собой."
"Можно ли подавать доĸументы и на бюджет, и на ĸонтраĸт?","Вы можете участвовать в конкурсе на обе основы обучения – и на бюджет, и на контракт, если в личном кабинете абитуриента на странице «Выбор образовательных программ» вы поставили обе отметки в соответствующих графах. Вы будете участвовать в конкурсе на бюджет даже после заключения договора на контракт."
"Участие в конкурсе на бюджет после заключения договора на контракт","Вы можете участвовать в конкурсе на обе основы обучения – и на бюджет, и на контракт, если в личном кабинете абитуриента на странице «Выбор образовательных программ» вы поставили обе отметки в соответствующих графах. Вы будете участвовать в конкурсе на бюджет даже после заключения договора на контракт."
"Если я не прошел на бюджетное место, могу ли я заключить договор на платное обучение?","Вы можете участвовать в конкурсе на обе основы обучения – и на бюджет, и на контракт, если в личном кабинете абитуриента на странице «Выбор образовательных программ» вы поставили обе отметки в соответствующих графах. Вы будете участвовать в конкурсе на бюджет даже после заключения договора на контракт."
"Я хочу подать на платное и бюджетное одновременно, так можно?","Вы можете участвовать в конкурсе на обе основы обучения – и на бюджет, и на контракт, если в личном кабинете абитуриента на странице «Выбор образовательных программ» вы поставили обе отметки в соответствующих графах. Вы будете участвовать в конкурсе на бюджет даже после заключения договора на контракт."
"Где можно увидеть стоимость обучения?","Вы можете узнать стоимость обучения в каталоге образовательных программ: programs.edu.urfu.ru Карточки программ содержат всю необходимую информацию: описание программы, вступительные испытания, количество мест и стоимость обучения. Также есть возможность ознакомиться с учебным планом и другими документами. Обычно оплата производится по семестрам, но возможна рассрочка и скидки. Также с особенностями оплаты обучения можно ознакомиться в приказе о стоимости обучения студентов по программам ВО в УрФУ."
"Сколько стоит обучение?","Вы можете узнать стоимость обучения в каталоге образовательных программ: programs.edu.urfu.ru Карточки программ содержат всю необходимую информацию: описание программы, вступительные испытания, количество мест и стоимость обучения. Также есть возможность ознакомиться с учебным планом и другими документами. Обычно оплата производится по семестрам, но возможна рассрочка и скидки. Также с особенностями оплаты обучения можно ознакомиться в приказе о стоимости обучения студентов по программам ВО в УрФУ."
"Где я могу узнать стоимость обучения? За какой период необходимо заплатить?","Вы можете узнать стоимость обучения в каталоге образовательных программ: programs.edu.urfu.ru Карточки программ содержат всю необходимую информацию: описание программы, вступительные испытания, количество мест и стоимость обучения. Также есть возможность ознакомиться с учебным планом и другими документами. Обычно оплата производится по семестрам, но возможна рассрочка и скидки. Также с особенностями оплаты обучения можно ознакомиться в приказе о стоимости обучения студентов по программам ВО в УрФУ."
"Стоимость обучения","Вы можете узнать стоимость обучения в каталоге образовательных программ: programs.edu.urfu.ru Карточки программ содержат всю необходимую информацию: описание программы, вступительные испытания, количество мест и стоимость обучения. Также есть возможность ознакомиться с учебным планом и другими документами. Обычно оплата производится по семестрам, но возможна рассрочка и скидки. Также с особенностями оплаты обучения можно ознакомиться в приказе о стоимости обучения студентов по программам ВО в УрФУ."
"Образовательный кредит","В 2022 году УрФУ открывает набор на рекордное число бюджетных мест – в магистратуре их более 2700. Рекомендуем подготовиться к тестированию и пробовать поступить на бюджет. А если не получилось, можете подать заявление на контракт и оформить образовательный кредит. Его отличает низкая процентная ставка благодаря господдержке, а также удобные условия для выплаты: во время учебы взносы меньше и идут на погашение процентов, а оплата по основному долгу начнется уже после завершения обучения. Подробную информацию по образовательному кредиту смотрите на странице «Образовательный кредит», на официальном сайте ПАО «Сбербанк» в разделе «Кредит на образование с господдержкой»."
"Кредит на образование с господдержкой","В 2022 году УрФУ открывает набор на рекордное число бюджетных мест – в магистратуре их более 2700. Рекомендуем подготовиться к тестированию и пробовать поступить на бюджет. А если не получилось, можете подать заявление на контракт и оформить образовательный кредит. Его отличает низкая процентная ставка благодаря господдержке, а также удобные условия для выплаты: во время учебы взносы меньше и идут на погашение процентов, а оплата по основному долгу начнется уже после завершения обучения. Подробную информацию по образовательному кредиту смотрите на странице «Образовательный кредит», на официальном сайте ПАО «Сбербанк» в разделе «Кредит на образование с господдержкой»."
"Магистратура: брать ли образовательный кредит?","В 2022 году УрФУ открывает набор на рекордное число бюджетных мест – в магистратуре их более 2700. Рекомендуем подготовиться к тестированию и пробовать поступить на бюджет. А если не получилось, можете подать заявление на контракт и оформить образовательный кредит. Его отличает низкая процентная ставка благодаря господдержке, а также удобные условия для выплаты: во время учебы взносы меньше и идут на погашение процентов, а оплата по основному долгу начнется уже после завершения обучения. Подробную информацию по образовательному кредиту смотрите на странице «Образовательный кредит», на официальном сайте ПАО «Сбербанк» в разделе «Кредит на образование с господдержкой»."
"Как можно получить образовательный кредит на обучение?","В 2022 году УрФУ открывает набор на рекордное число бюджетных мест – в магистратуре их более 2700. Рекомендуем подготовиться к тестированию и пробовать поступить на бюджет. А если не получилось, можете подать заявление на контракт и оформить образовательный кредит. Его отличает низкая процентная ставка благодаря господдержке, а также удобные условия для выплаты: во время учебы взносы меньше и идут на погашение процентов, а оплата по основному долгу начнется уже после завершения обучения. Подробную информацию по образовательному кредиту смотрите на странице «Образовательный кредит», на официальном сайте ПАО «Сбербанк» в разделе «Кредит на образование с господдержкой»."
"Скидки для учащихся на контракте","Абитуриентам и студентам УрФУ предоставляются скидки по оплате обучения в зависимости от успеваемости и материального положения. При оформлении договора на оказание образовательных услуг действует комфортная для плательщиков система формирования графика платежей. Помимо стандартного графика, предусмотрена возможность предоставления рассрочки, либо скидки при существенном авансировании оплаты за обучение. Кроме того, для студентов и абитуриентов на 2022 год сохранена возможность получения образовательного кредита с государственной поддержкой, в том числе для оплаты обучения по ранее заключенным договорам на старших курсах."
"Скидки на платной основе обучения","Абитуриентам и студентам УрФУ предоставляются скидки по оплате обучения в зависимости от успеваемости и материального положения. При оформлении договора на оказание образовательных услуг действует комфортная для плательщиков система формирования графика платежей. Помимо стандартного графика, предусмотрена возможность предоставления рассрочки, либо скидки при существенном авансировании оплаты за обучение. Кроме того, для студентов и абитуриентов на 2022 год сохранена возможность получения образовательного кредита с государственной поддержкой, в том числе для оплаты обучения по ранее заключенным договорам на старших курсах."
"Есть ли скидки для платников?","Абитуриентам и студентам УрФУ предоставляются скидки по оплате обучения в зависимости от успеваемости и материального положения. При оформлении договора на оказание образовательных услуг действует комфортная для плательщиков система формирования графика платежей. Помимо стандартного графика, предусмотрена возможность предоставления рассрочки, либо скидки при существенном авансировании оплаты за обучение. Кроме того, для студентов и абитуриентов на 2022 год сохранена возможность получения образовательного кредита с государственной поддержкой, в том числе для оплаты обучения по ранее заключенным договорам на старших курсах."
