Question,Answer
"Магистратура и ее партнеры: что может получить магистрант?","Офисы всех программ магистратуры в УрФУ взаимодействуют с несколькими сильными работодателями и академическими партнерами. Сотрудники организаций станут вашими лекторами и менторами: познакомят с трендами отрасли, обучат актуальным компетенциям. Все это на примере реальных задач науки или бизнеса. Более того, некоторые магистерские программы созданы по инициативе компаний и развиваются под руководством работодателей. Среди них – Сбер, VK, Группа Синара, SAP, Росатом, МТС и другие."
"Какие партнеры есть у вуза?","Офисы всех программ магистратуры в УрФУ взаимодействуют с несколькими сильными работодателями и академическими партнерами. Сотрудники организаций станут вашими лекторами и менторами: познакомят с трендами отрасли, обучат актуальным компетенциям. Все это на примере реальных задач науки или бизнеса. Более того, некоторые магистерские программы созданы по инициативе компаний и развиваются под руководством работодателей. Среди них – Сбер, VK, Группа Синара, SAP, Росатом, МТС и другие."
"Полезные ссылки","Прием документов начинается с 20 июня. Календарь приема: magister.urfu.ru/ru/documents/kalendar-priema Правила приема: magister.urfu.ru/fileadmin/user_upload/site_15406/2023/admission/Pravila_priema_magistratura_2023.pdf План приема (бюджет): magister.urfu.ru/fileadmin/user_upload/site_15406/2023/admission/Plan_priema_magistratura_2023_god.pdf Каталог программ: programs.edu.urfu.ru Личный кабинет абитуриента: priem.urfu.ru Списки поступающих и зачисленных: urfu.ru/ru/alpha/full magister.urfu.ru/ru/enrolled Контакты приемной комиссии: magister.urfu.ru/ru/kontakty"
"Важные даты поступления","Прием документов начинается с 20 июня. Календарь приема: magister.urfu.ru/ru/documents/kalendar-priema Правила приема: magister.urfu.ru/fileadmin/user_upload/site_15406/2023/admission/Pravila_priema_magistratura_2023.pdf План приема (бюджет): magister.urfu.ru/fileadmin/user_upload/site_15406/2023/admission/Plan_priema_magistratura_2023_god.pdf Каталог программ: programs.edu.urfu.ru Личный кабинет абитуриента: priem.urfu.ru Списки поступающих и зачисленных: urfu.ru/ru/alpha/full magister.urfu.ru/ru/enrolled Контакты приемной комиссии: magister.urfu.ru/ru/kontakty"
"Сроки приема заявлений","Прием документов начинается с 20 июня. Календарь приема: magister.urfu.ru/ru/documents/kalendar-priema Правила приема: magister.urfu.ru/fileadmin/user_upload/site_15406/2023/admission/Pravila_priema_magistratura_2023.pdf План приема (бюджет): magister.urfu.ru/fileadmin/user_upload/site_15406/2023/admission/Plan_priema_magistratura_2023_god.pdf Каталог программ: programs.edu.urfu.ru Личный кабинет абитуриента: priem.urfu.ru Списки поступающих и зачисленных: urfu.ru/ru/alpha/full magister.urfu.ru/ru/enrolled Контакты приемной комиссии: magister.urfu.ru/ru/kontakty"
"Календарь приема","Прием документов начинается с 20 июня. Календарь приема: magister.urfu.ru/ru/documents/kalendar-priema Правила приема: magister.urfu.ru/fileadmin/user_upload/site_15406/2023/admission/Pravila_priema_magistratura_2023.pdf План приема (бюджет): magister.urfu.ru/fileadmin/user_upload/site_15406/2023/admission/Plan_priema_magistratura_2023_god.pdf Каталог программ: programs.edu.urfu.ru Личный кабинет абитуриента: priem.urfu.ru Списки поступающих и зачисленных: urfu.ru/ru/alpha/full magister.urfu.ru/ru/enrolled Контакты приемной комиссии: magister.urfu.ru/ru/kontakty"
"Правила приема в магистратуру","Прием документов начинается с 20 июня. Календарь приема: magister.urfu.ru/ru/documents/kalendar-priema Правила приема: magister.urfu.ru/fileadmin/user_upload/site_15406/2023/admission/Pravila_priema_magistratura_2023.pdf План приема (бюджет): magister.urfu.ru/fileadmin/user_upload/site_15406/2023/admission/Plan_priema_magistratura_2023_god.pdf Каталог программ: programs.edu.urfu.ru Личный кабинет абитуриента: priem.urfu.ru Списки поступающих и зачисленных: urfu.ru/ru/alpha/full magister.urfu.ru/ru/enrolled Контакты приемной комиссии: magister.urfu.ru/ru/kontakty"
"Особенности приема в магистратуру в 2023 году","Прием документов начинается с 20 июня. Календарь приема: magister.urfu.ru/ru/documents/kalendar-priema Правила приема: magister.urfu.ru/fileadmin/user_upload/site_15406/2023/admission/Pravila_priema_magistratura_2023.pdf План приема (бюджет): magister.urfu.ru/fileadmin/user_upload/site_15406/2023/admission/Plan_priema_magistratura_2023_god.pdf Каталог программ: programs.edu.urfu.ru Личный кабинет абитуриента: priem.urfu.ru Списки поступающих и зачисленных: urfu.ru/ru/alpha/full magister.urfu.ru/ru/enrolled Контакты приемной комиссии: magister.urfu.ru/ru/kontakty"
"Каковы даты завершения приема доĸументов?","Прием документов начинается с 20 июня. Календарь приема: magister.urfu.ru/ru/documents/kalendar-priema Правила приема: magister.urfu.ru/fileadmin/user_upload/site_15406/2023/admission/Pravila_priema_magistratura_2023.pdf План приема (бюджет): magister.urfu.ru/fileadmin/user_upload/site_15406/2023/admission/Plan_priema_magistratura_2023_god.pdf Каталог программ: programs.edu.urfu.ru Личный кабинет абитуриента: priem.urfu.ru Списки поступающих и зачисленных: urfu.ru/ru/alpha/full magister.urfu.ru/ru/enrolled Контакты приемной комиссии: magister.urfu.ru/ru/kontakty"
"Каковы сроки подачи документов?","Прием документов начинается с 20 июня. Календарь приема: magister.urfu.ru/ru/documents/kalendar-priema Правила приема: magister.urfu.ru/fileadmin/user_upload/site_15406/2023/admission/Pravila_priema_magistratura_2023.pdf План приема (бюджет): magister.urfu.ru/fileadmin/user_upload/site_15406/2023/admission/Plan_priema_magistratura_2023_god.pdf Каталог программ: programs.edu.urfu.ru Личный кабинет абитуриента: priem.urfu.ru Списки поступающих и зачисленных: urfu.ru/ru/alpha/full magister.urfu.ru/ru/enrolled Контакты приемной комиссии: magister.urfu.ru/ru/kontakty"
"Когда можно подать доĸументы на поступление?","Прием документов начинается с 20 июня. Календарь приема: magister.urfu.ru/ru/documents/kalendar-priema Правила приема: magister.urfu.ru/fileadmin/user_upload/site_15406/2023/admission/Pravila_priema_magistratura_2023.pdf План приема (бюджет): magister.urfu.ru/fileadmin/user_upload/site_15406/2023/admission/Plan_priema_magistratura_2023_god.pdf Каталог программ: programs.edu.urfu.ru Личный кабинет абитуриента: priem.urfu.ru Списки поступающих и зачисленных: urfu.ru/ru/alpha/full magister.urfu.ru/ru/enrolled Контакты приемной комиссии: magister.urfu.ru/ru/kontakty"
"Календарь приемной кампании 2023","Прием документов начинается с 20 июня. Календарь приема: magister.urfu.ru/ru/documents/kalendar-priema Правила приема: magister.urfu.ru/fileadmin/user_upload/site_15406/2023/admission/Pravila_priema_magistratura_2023.pdf План приема (бюджет): magister.urfu.ru/fileadmin/user_upload/site_15406/2023/admission/Plan_priema_magistratura_2023_god.pdf Каталог программ: programs.edu.urfu.ru Личный кабинет абитуриента: priem.urfu.ru Списки поступающих и зачисленных: urfu.ru/ru/alpha/full magister.urfu.ru/ru/enrolled Контакты приемной комиссии: magister.urfu.ru/ru/kontakty"
"План приема в 2023 году","С контрольными цифрами приема в 2023 году можно ознакомиться в документе: magister.urfu.ru/fileadmin/user_upload/site_15406/2023/admission/Plan_priema_magistratura_2023_god.pdf"
"Количество мест для приема","С контрольными цифрами приема в 2023 году можно ознакомиться в документе: magister.urfu.ru/fileadmin/user_upload/site_15406/2023/admission/Plan_priema_magistratura_2023_god.pdf"
"Число бюджетных мест","С контрольными цифрами приема в 2023 году можно ознакомиться в документе: magister.urfu.ru/fileadmin/user_upload/site_15406/2023/admission/Plan_priema_magistratura_2023_god.pdf"
"Бюджетные места","С контрольными цифрами приема в 2023 году можно ознакомиться в документе: magister.urfu.ru/fileadmin/user_upload/site_15406/2023/admission/Plan_priema_magistratura_2023_god.pdf"
"КЦП","С контрольными цифрами приема в 2023 году можно ознакомиться в документе: magister.urfu.ru/fileadmin/user_upload/site_15406/2023/admission/Plan_priema_magistratura_2023_god.pdf"
"Есть ли в магистратуре бюджетные места?","С контрольными цифрами приема в 2023 году можно ознакомиться в документе: magister.urfu.ru/fileadmin/user_upload/site_15406/2023/admission/Plan_priema_magistratura_2023_god.pdf"
"Количество мест на бюджет","С контрольными цифрами приема в 2023 году можно ознакомиться в документе: magister.urfu.ru/fileadmin/user_upload/site_15406/2023/admission/Plan_priema_magistratura_2023_god.pdf"
"Сколько бюджетных мест?","С контрольными цифрами приема в 2023 году можно ознакомиться в документе: magister.urfu.ru/fileadmin/user_upload/site_15406/2023/admission/Plan_priema_magistratura_2023_god.pdf"
"Где я могу ознакомиться с количеством бюджетных мест?","С контрольными цифрами приема в 2023 году можно ознакомиться в документе: magister.urfu.ru/fileadmin/user_upload/site_15406/2023/admission/Plan_priema_magistratura_2023_god.pdf"
"Контрольные цифры приема","С контрольными цифрами приема в 2023 году можно ознакомиться в документе: magister.urfu.ru/fileadmin/user_upload/site_15406/2023/admission/Plan_priema_magistratura_2023_god.pdf"
"На сколько программ можно подавать документы?","Вы можете выбрать до 7 направлений и внутри каждого направления выбрать образовательные программы, на которые можно сразу отметить обе основы обучения – и бюджет, и контракт. Вы будете участвовать в конкурсе на бюджет, даже после заключения договора на контракт."
"На сколько образовательных программ я могу подать документы?","Вы можете выбрать до 7 направлений и внутри каждого направления выбрать образовательные программы, на которые можно сразу отметить обе основы обучения – и бюджет, и контракт. Вы будете участвовать в конкурсе на бюджет, даже после заключения договора на контракт."
"На сколько направлений можно подать документы в вуз?","Вы можете выбрать до 7 направлений и внутри каждого направления выбрать образовательные программы, на которые можно сразу отметить обе основы обучения – и бюджет, и контракт. Вы будете участвовать в конкурсе на бюджет, даже после заключения договора на контракт."
"Сколько направлений можно выбрать?","Вы можете выбрать до 7 направлений и внутри каждого направления выбрать образовательные программы, на которые можно сразу отметить обе основы обучения – и бюджет, и контракт. Вы будете участвовать в конкурсе на бюджет, даже после заключения договора на контракт."
"Как поступить в магистратуру?","План поступления в магистратуру УрФУ: – Узнайте даты и правила приема – Выберите образовательную программу, зарегистрируйтесь в личном кабинете абитуриента и подайте документы – Пройдите вступительные испытания – Предоставьте оригиналы документов, следите за конкурсными списками и выходом приказа о зачислении Инструкции по поступлению: priem.urfu.ru/#/how-to youtu.be/8mLv8bJZOHg Напишите мне фразу «Полезные ссылки», чтобы получить актуальную информацию и узнать особенности приема в магистратуру в 2023 году."
"С чего начать поступление?","План поступления в магистратуру УрФУ: – Узнайте даты и правила приема – Выберите образовательную программу, зарегистрируйтесь в личном кабинете абитуриента и подайте документы – Пройдите вступительные испытания – Предоставьте оригиналы документов, следите за конкурсными списками и выходом приказа о зачислении Инструкции по поступлению: priem.urfu.ru/#/how-to youtu.be/8mLv8bJZOHg Напишите мне фразу «Полезные ссылки», чтобы получить актуальную информацию и узнать особенности приема в магистратуру в 2023 году."
"Как поступить?","План поступления в магистратуру УрФУ: – Узнайте даты и правила приема – Выберите образовательную программу, зарегистрируйтесь в личном кабинете абитуриента и подайте документы – Пройдите вступительные испытания – Предоставьте оригиналы документов, следите за конкурсными списками и выходом приказа о зачислении Инструкции по поступлению: priem.urfu.ru/#/how-to youtu.be/8mLv8bJZOHg Напишите мне фразу «Полезные ссылки», чтобы получить актуальную информацию и узнать особенности приема в магистратуру в 2023 году."
"Каĸ подать доĸументы?","План поступления в магистратуру УрФУ: – Узнайте даты и правила приема – Выберите образовательную программу, зарегистрируйтесь в личном кабинете абитуриента и подайте документы – Пройдите вступительные испытания – Предоставьте оригиналы документов, следите за конкурсными списками и выходом приказа о зачислении Инструкции по поступлению: priem.urfu.ru/#/how-to youtu.be/8mLv8bJZOHg Напишите мне фразу «Полезные ссылки», чтобы получить актуальную информацию и узнать особенности приема в магистратуру в 2023 году."
"Могу ли я изменить порядок приоритета выбранных направлений для поступления, если я уже подал документы?","У вас есть возможность изменять выбор направлений подготовки через личный кабинет абитуриента priem.urfu.ru Изменения можно вносить до окончания срока подачи документов по выбранной вами форме обучения. Календарь приема: magister.urfu.ru/ru/documents/kalendar-priema Инструкции по использованию личного кабинета абитуриента: priem.urfu.ru/#/how-to"
"Как изменить приоритеты направлений подготовки?","У вас есть возможность изменять выбор направлений подготовки через личный кабинет абитуриента priem.urfu.ru Изменения можно вносить до окончания срока подачи документов по выбранной вами форме обучения. Календарь приема: magister.urfu.ru/ru/documents/kalendar-priema Инструкции по использованию личного кабинета абитуриента: priem.urfu.ru/#/how-to"
"До какого числа можно изменить выбранные направления, указанные при подаче заявления на участие в конкурсе?","У вас есть возможность изменять выбор направлений подготовки через личный кабинет абитуриента priem.urfu.ru Изменения можно вносить до окончания срока подачи документов по выбранной вами форме обучения. Календарь приема: magister.urfu.ru/ru/documents/kalendar-priema Инструкции по использованию личного кабинета абитуриента: priem.urfu.ru/#/how-to"
"Можно ли менять порядок приоритета выбранных направлений?","У вас есть возможность изменять выбор направлений подготовки через личный кабинет абитуриента priem.urfu.ru Изменения можно вносить до окончания срока подачи документов по выбранной вами форме обучения. Календарь приема: magister.urfu.ru/ru/documents/kalendar-priema Инструкции по использованию личного кабинета абитуриента: priem.urfu.ru/#/how-to"
"Как подать документы в дистанционной форме?","Подать документы в этом году можно будет тремя способами: – Лично по адресу: г. Екатеринбург, ул, Мира, 19 или в одном из филиалов УрФУ (предварительная регистрация в личном кабинете абитуриента обязательна) – По почте (заявление и листы участника конкурса распечатываются после регистрации в личном кабинете абитуриента) – В дистанционной форме через личный кабинет абитуриента priem.urfu.ru Инструкции по поступлению: priem.urfu.ru/#/how-to youtu.be/8mLv8bJZOHg"
"Способы подачи документов","Подать документы в этом году можно будет тремя способами: – Лично по адресу: г. Екатеринбург, ул, Мира, 19 или в одном из филиалов УрФУ (предварительная регистрация в личном кабинете абитуриента обязательна) – По почте (заявление и листы участника конкурса распечатываются после регистрации в личном кабинете абитуриента) – В дистанционной форме через личный кабинет абитуриента priem.urfu.ru Инструкции по поступлению: priem.urfu.ru/#/how-to youtu.be/8mLv8bJZOHg"
"Где можно найти образец заявления и других документов, которые нужно отправить по почте?","Подать документы в этом году можно будет тремя способами: – Лично по адресу: г. Екатеринбург, ул, Мира, 19 или в одном из филиалов УрФУ (предварительная регистрация в личном кабинете абитуриента обязательна) – По почте (заявление и листы участника конкурса распечатываются после регистрации в личном кабинете абитуриента) – В дистанционной форме через личный кабинет абитуриента priem.urfu.ru Инструкции по поступлению: priem.urfu.ru/#/how-to youtu.be/8mLv8bJZOHg"
"Как подать документы в электронном виде?","Подать документы в этом году можно будет тремя способами: – Лично по адресу: г. Екатеринбург, ул, Мира, 19 или в одном из филиалов УрФУ (предварительная регистрация в личном кабинете абитуриента обязательна) – По почте (заявление и листы участника конкурса распечатываются после регистрации в личном кабинете абитуриента) – В дистанционной форме через личный кабинет абитуриента priem.urfu.ru Инструкции по поступлению: priem.urfu.ru/#/how-to youtu.be/8mLv8bJZOHg"
